{
  "@context": [
    "https://www.w3.org/ns/credentials/v2",
    "https://raw.githubusercontent.com/nfh-trust-labs/opencred-vc-schemas/main/schemas/functional-identity/v1/context.jsonld"
  ],
  "id": "urn:uuid:00000000-0000-4000-8000-000000000001",
  "type": [
    "VerifiableCredential",
    "FunctionalIdentityCredential"
  ],
  "issuer": {
    "id": "did:web:issuer.example",
    "name": "Example Issuer"
  },
  "validFrom": "2026-04-08T00:00:00Z",
  "credentialSubject": {
    "id": "did:example:subject",
    "name": "Dr. Barbara McClintock",
    "role": "Medical Practitioner",
    "roleScheme": "https://www.ilo.org/isco-08",
    "roleCode": "2211",
    "roleCategory": "licensed-professional",
    "affiliation": {
      "name": "State Medical Council"
    },
    "membershipId": "SMC-2024-44812",
    "validFrom": "2026-01-01T00:00:00Z",
    "validUntil": "2027-01-01T00:00:00Z"
  }
}
